input,output
I'm happy.,ကျွန်တော် ပျော်တယ်။
I'm nervous.,ကျွန်တော် စိတ်ရှုပ်ထွေးတယ်။
I am confused.,ကျွန်တော် ဝေခွဲမရ ရှုပ်ထွေးနေတယ်။
I'm excited.,ကျွန်တော် စိတ်လှုပ်ရှားတယ်။
I am very happy.,ကျွန်တော် သိပ်ပျော်တယ်။
I'm extremely tired.,ကျွန်တော် အလွန်အမင်း ပင်ပန်းတယ်။
I'm super excited.,ကျွန်တော် အရမ်းအရမ်း စိတ်လှုပ်ရှားပါတယ်။
I'm crying.,ကျွန်တော် ငိုနေတယ်။
I am reading newspaper.,ကျွန်တော် သတင်းစာဖတ်နေတယ်။
I'm leaving tomorrow.,မနက်ဖြန် ကျွန်တော် သွားတော့မယ်။
I'm leaving now.,ကျွန်တော် အခုပဲ သွားပြီ။
He isn't working next week.,သူ နောက်တစ်ပါတ်မှာ အလုပ် လုပ်တော့မှာ မဟုတ်ဘူး။
I'm from Mandalay.,ကျွန်တော် မန္တလေးကပါ။
I am in the office at the moment.,အခု လောလောဆယ် ကျွန်တော် ရုံးမှာ ရှိပါတယ်။
I'm twenty three years old.,ကျွန်တော် အသက် ၂၃ နှစ်ပါ။
I'm good at drawing.,ကျွန်တော်က ပုံဆွဲတာ တော်ပါတယ်။
I am good at video games.,ကျွန်တော်က ဗီဒီယိုဂိမ်း ကစားရာမှာ တော်ပါတယ်။
I am good at sports.,ကျွန်တော်က အားကစားမှာ တော်ပါတယ်။
I'm good at math.,ကျွန်တော်က သင်္ချာတွက်ရာမှာ တော်ပါတယ်။
I'm good at chess.,ကျွန်တော်က စစ်တုရင် ကစားရာမှာ တော်ပါတယ်။
I'm getting better.,ကျွန်တော် နေကောင်းလာပြီ။
I'm getting a tooth ache.,ကျွန်တော် သွားကိုက်နေပြီ။
I am getting a cold.,ကျွန်တော် အအေးမိနေပြီ။
I'm getting a job.,ကျွန်တော် အလုပ် တစ်ခု ရနေပြီ။
I am getting a tired.,ကျွန်တော် ပင်ပန်းနေပြီ။
I'm getting a new car.,ကျွန်တော်မှာ ကား အသစ် တစ်စီး ရနေပြီ။
I'm getting a puppy.,ကျွန်တော်မှာ ခွေးပေါက်ကလေး တစ်ကောင် ရနေပြီ။
I'm getting ready for bed.,ကျွန်တော် အိပ်ယာ ဝင်ဖို့ အသင့် ဖြစ်ပါပြီ။
I am getting ready for the match.,ကျွန်တော် ပြိုင်ပွဲ ဝင်ဖို့ အဆင်သင့် ဖြစ်ပါပြီ။
I'm trying to get a job.,ကျွန်တော် အလုပ် တစ်ခု ရဖို့ ကြိုးစားနေပါတယ်။
I'm trying to speak English fluently.,ကျွန်တော် အင်္ဂလိပ်စာကို မြန်ဆန်စွာ ပြောတတ်ဖို့ ကြိုးစားနေပါတယ်။
I am trying to educate the learners.,ကျွန်တော် လေ့လာသူတွေကို ပညာ မျှဝေ သင်ကြားပေးဖို့ ကြိုးစားနေပါတယ်။
I'm trying to explain about this case.,ကျွန်တော် ဒီကိစ္စနဲ့ ပါတ်သတ်ပြီး ရှင်းပြဖို့ ကြိုးစားနေပါတယ်။
I'm trying to eat healthy.,ကျွန်တော် ကျန်းမာရေးနဲ့ ညီညွတ်အောင် စားသောက်ဖို့ ကြိုးစားနေပါတယ်။
I am trying to understand myself.,ကျွန်တော်ကို ကျွန်တော် နားလည်ဖို့ ကြိုးစားနေပါတယ်။
I used to walk every day.,ကျွန်တော် နေ့တိုင်း လမ်းလျှောက်ထွက်တဲ့ အလေ့အကျင့် ရှိခဲ့ပါတယ်။
I used to smoke.,ကျွန်တော် ဆေးလိပ် သောက်တဲ့ အကျင့် ရှိခဲ့ပါတယ်။
I used to live in Myingyan.,ကျွန်တော် မြင်းခြံမှာ နေခဲ့ဖူးပါတယ်။
I used to start work at 7 o'clock.,ကျွန်တာ် ၇ နာရီမှာ အလုပ် စဆင်းတဲ့ အကျင့် ရှိခဲ့ပါတယ်။
I used to paint.,ကျွန်တော် ပန်းချီဆွဲတဲ့ အကျင့် ရှိခဲ့ပါတယ်။
There used to be a cinema here.,ဒီနေရာမှာ ရုပ်ရှင်ရုံ တစ်ရုံ ရှိခဲ့ဖူးတယ်။
I have to go now.,ကျွန်တော် အခု သွားရမယ်။
I have to switch schools.,ကျွန်တော် ကျောင်း ပြောင်းရမယ်။
I have to go to the bank to tranfer the money.,ကျွန်တော် ငွေ လွှဲပို့ဖို့အတွက် ဘဏ်ကို သွားရမယ်။
I have to finish the term paper today.,ကျွန်တော် စာတမ်းကို ဒီနေ့ အပြီးသတ်ရမယ်။
I don't have to switich schools.,ကျွန်တော် ကျောင်း ပြောင်းရမှာ မဟုတ်ဘူး။
I don't have to get there on time.,ကျွန်တော် အဲ့ဒီကို အချိန်မှီ ရောက်ဖို့ မလိုဘူး။
The boss is away today.,ဒီနေ့ သူဌေးက အဝေးကို သွားနေတယ်။
I don't have to work overtime on Saturday.,စနေနေ့မှာ ကျွန်တော် အချိန်ပို လုပ်ဖို့ မလိုဘူး။
Do I have to work overtime on Saturday?,စနေနေ့မှာ ကျွန်တော် အချိန်ပို လုပ်ရမှာလား။
I have got to take this book back to the library or I'll get a fine.,ကျွန်တော် ဒီစာအုပ်ကို စာကြည့်တိုက်သို့ ပြန်ပို့ပေးရမယ်၊ သို့မဟုတ်လျင် ကျွန်တော် ဒဏ်ကြေး ပေးရလိမ့်မယ်။
I must og to bed earlier.,ကျွန်တော် စောစော အိပ်ယာ ထရမယ်။
I must go and see my brother every Sunday.,တနင်္ဂနွေ နေ့တိုင်း ကျွန်တော့် ညီကို  သွားတွေ့ရမယ်။
I have to arrive at work at 9 sharp.,ကျွန်တော် အလုပ်ကို ၉ နာရီ တိတိမှာ ရောက်ရမယ်။
My boss is very strict.,ကျွန်တော့် သူဌေးက စည်းကမ်း တင်းကျပ်တယ်။
I have to send a report to Head Office every week.,ကျွန်တော် အပါတ်တိုင်း ရုံးချုပ်ကို အစိရင်ခံစာ တစ်စောင် ပေးပို့ရပါတယ်။
I will have to explain to him.,ကျွန်တော် သူ့ကို ရှင်းပြ ရပါ့လိမ့်မယ်။
I would have to do it for my Managing Director.,ကျွန်တော့် ဆရာ ညွှန်ကြားရေးမှူး အတွက် အဲ့ဒါကို လုပ်ပေး ရပါ့လိမ့်မယ်။
Miss Universe has to be fluent in English.,မယ်စက်ြာဝဠာဟာ အင်္ဂလိပ်စာကို သွက်လက် ချောမွေ့စွာ ပြောရပါမယ်။
Miss Universe must be beautiful and talented.,မယ်စက်ြာဝဠာဟာ လှပပြီး ပင်ကိုယ် အရည်အချင်း ရှိရမယ်။
I plan to find a new apartment.,ကျွန်တော် အခန်း အသစ် ရှာဖို့ စိတ်ကူး နေခဲ့ဖူးပါတယ်။
I plan to relex on vacation.,ကျွန်တော် အပန်းဖြေ ခရီးမှာ အနားယူဖို့ ကြံစည် နေခဲ့ဖူးပါတယ်။
I plan to suprise my parents.,ကျွန်တော့် မိဘတွေကို အံဲ့ဩအောင် လုပ်ဖို့ စီမံ နေခဲ့ဖူးပါတယ်။
I plan to go abroad.,ကျွန်တော် နိုင်ငံခြား သွားဖို့ ပြင်ဆင် နေခဲ့ဖူးပါတယ်။
I plan to adopt a child.,ကျွန်တော် ကလေး တစ်ယောက် မွေးစားဖို့ လုပ်နေပါတယ်။
I plan to watch a movie.,ကျွန်တော် ရုပ်ရှင် ကြည့်ဖို့ စီစဉ် နေခဲ့ဖူးပါတယ်။
I plan to save more money.,ကျွန်တော် ပိုက်ဆံ ပိုစုဖို့ အစီအစဉ် ချနေပါတယ်။
I've decided to complete my degree.,ကျွန်တော်ရဲ့ ဘွဲ့ကို ပြီးဆုံးအောင် သင်ယူဖို့ ဆုံးဖြတ်လိုက်ပြီ။
I've decided to change my bed habits.,ကျွန်တော့်ရဲ့ ဆိုးဝါးတဲ့ အကျင့်တွေကို ပြင်ဖို့ ဆုံးဖြတ်လိုက်ပြီ။
I have decided to extend my membership at the libary.,စာကြည့်တိုက်မှာ ကျွန်တော် အသင်းဝင် သက်တမ်း တိုးမြှင့်ဖို့ ဆုံးဖြတ်လိုက်ပြီ။
I have decided to hand over my responsibilities.,ကျွန်တော့်ရဲ့ လုပ်ဆောင်ရမယ့် တာဝန်တွေကို လွှဲပြောင်းပေးဖို့ ဆုံးဖြတ်လိုက်ပြီ။
I've decided to increase my work load.,ကျွန်တော့်ရဲ့ အလုပ်တာဝန်း ပမာဏကို တိုးမြှင့်ယူဖို့ ဆုံးဖြတ်လိုက်ပြီ။
I have decided to manage a store.,အရောင်းဆိုင် တစ်ခုကို အုပ်ချုပ် စီမံဖို့ ဆုံးဖြတ်လိုက်ပြီ။
I was about to go out.,ကျွန်တော် အပြင် ထွက်တော့မလို့ပါ။
I was about to go to dinner.,ကျွန်တော် ညစာ စားပွဲကို သွားတော့မလို့ပါ။
I was about to go to work.,ကျွန်တော် အလုပ် သွားတော့မလို့ပါ။
I was about to go to bed.,ကျွန်တော် အိပ်ယာ ဝင်တော့မလို့ပါ။
I was about to say the same thing.,ကျွန်တော်လည်း အတူတူပဲ ပြောတော့မလို့ပါ။
I was about to call you.,ကျွန်တော် ခင်ဗျားကို ဖုန်းခေါ်တော့မလို့ပါ။
I was about to send you an email.,ကျွန်တော် ခင်ဗျားကို email ပို့တော့မလို့ပါ။
I was about to order us some drinks.,ကျွန်တော်တို့အတွက် သောက်စရာ တစ်ခုခု မှာတော့မလို့ပါ။
I didn't mean to hurt your feelings.,ခင်ဗျားရဲ့ ခံစားချက်ကို နာကျင်စေဖို့ ကျွန်တော် မရည်ရွယ်ခဲ့ပါဘူး။
I didn't mean to break your heart.,ခင်ဗျားရဲ့ အသဲကို ခွဲဖို့ ကျွန်တော် မရည်ရွယ်ခဲ့ပါဘူး။
I didn't mean to call you so late.,ခင်ဗျားကို နောက်ကျပြီးမှာ ဖုန်းခေါ်ဖို့ ကျွန်တော် မရည်ရွယ်ခဲ့ပါဘူး။
I didn't mean to lie about what happened.,ဘာဖြစ်ခဲ့တယ်ဆိုတာနဲ့ ပါတ်သတ်ပြီး လိမ်လည်ဖို့ ကျွန်တော် မရည်ရွယ်ခဲ့ပါဘူး။
I didn't mean to embrassass you.,ခင်ဗျားကို အရှက် ရစေဖို့ ကျွန်တော် မရည်ရွယ်ခဲ့ပါဘူး။
I did not mean to stay out so late.,အလွန် နောက်ကျပြီး အပြင်မှာနေဖို့ ကျွန်တော် မရည်ရွယ်ခဲ့ပါဘူး။
I did not mean to say those things.,အဲ့ဒီ အကြောင်းကို ပြောဖို့ ကျွန်တော် မရည်ရွယ်ခဲ့ပါဘူး။
I did not mean to leave you out.,ခင်ဗျားကို အပြင်မှာ ချန်ထားခဲ့ဖို့ ကျွန်တော် မရည်ရွယ်ခဲ့ပါဘူး။
I did not mean to make you confused.,ခင်ဗျားကို စိတ်ရှုပ်ထွေးအောင် လုပ်ဖို့ ကျွန်တော် မရည်ရွယ်ခဲ့ပါဘူး။
I did not mean to cause trouble.,ခင်ဗျားကို ဒုက္ခ ရောက်စေဖို့ ကျွန်တော် မရည်ရွယ်ခဲ့ပါဘူး။
I promise not to tell the secret.,လျှို့ဝှက်ချက်ကို ထုတ်မပြောဘူးလို့ ကျွန်တော် ကတိပေးပါတယ်။
I promise not to leave without you.,ခင်ဗျား မပါဘဲ ထွက်မသွားဘူးလို့ ကျွန်တော် ကတိပေးပါတယ်။
I promise not to hurt your feelings.,ခင်ဗျားရဲ့ ခံစားချက်တွေကို နာကျင်အောင် မလုပ်ဘူးဖို့ ကျွန်တော် ကတိပေးပါတယ်။
I promise not to wake you up.,ခင်ဗျားကို အိပ်ယာက နိုးအောင် မလုပ်ဘူးလို့ ကျွန်တော် ကတိပေးပါတယ်။
I promise not to be so late.,အရမ်း နောက်မကျပါဘူးလို့ ကျွန်တော် ကတိပေးပါတယ်။
I promise I am telling the truth.,အမှန်ကို ပြောနေတယ်လို့ ကျွန်တော် ကတိပြုပါတယ်။
I promise to parctice my math.,သင်္ချာတွေ လေ့ကျင့်ပါ့မယ်လို့ ကျွန်တော် ကတိပြုပါတယ်။
I promise to call you.,ခင်ဗျားကို ဖုန်းခေါ်ပါ့မယ်လို့ ကျွန်တော် ကတိပေးပါတယ်။
I promise I will tell you about my past.,ကျွန်တော်ရဲ့ အတိတ်နဲ့ ပါတ်သတ်ပြီး အမှန်ကို ပြောပါ့မယ်လို့ ကတိပြုပါတယ်။
I promise I will com to your party.,ခင်ဗျားရဲ့ ပါတီကို လာပါ့မယ်လို့ ကတိပေးပါတယ်။
I'm not used to having so much stress.,ကျွန်တော် ဖိစီးမှုတွေ များနေတာတွေနဲ့ အကျွမ်းတဝင် မရှိပါဘူး။
I'm not used to traveling so much.,ကျွန်တော် အလွန်အမင် ခရီးသွားတဲ့ အကျင့် မရှိပါဘူး။
I am not used to working so early.,ကျွန်တော် အရမ်း စောစောကြီး အလုပ် လုပ်တဲ့ အကျင့် မရှိပါဘူး။
I am not used to talking English.,ကျွန်တော် အင်္ဂလိပ်စာ ပြောဆိုတဲ့ အကျင့် မရှိခဲ့ပါဘူး။
I'm used to smoking.,ကျွန်တော် ဆေးလိပ် သောက်တဲ့ အကျင့် ရှိခဲ့ပါတယ်။
I am used to travelling so much.,ကျွန်တော် ခရီးတွေ အရမ်း သွားတတ်တဲ့ အကျင့် ရှိခဲ့ပါတယ်။
Are you used to smoking?,ခင်ဗျား ဆေးလိပ် သောက်တဲ့ အကျင့် ရှိလား။
Are you used to talking in front of groups of people.,ခင်ဗျား လူအုပ်စုတွေ ရှေ့မှာ စကားပြောတဲ့ အကျင့် ရှိပါသလား။
I used to wrok hard.,ကျွန်တော် အလုပ်ကို ကြိုးစားလုပ်တဲ့ အကျင့် ရှိခဲ့ပါတယ်။
I used to love her.,ကျွန်တော် သူမကို ချစ်ခဲ့ပါတယ်။
I got a degree of Mathematics form Mandalay University.,ကျွန်တော် မန္တလေး တက္ကသိုလ်ကနေပြီး သင်္ချာဘွဲ့ ရှိခဲ့ပါတယ်။
Did you used to smoke?,ခင်ဗျား အရင်က ဆေးလိပ် သောက်တဲ့ အကျင့် ရှိခဲ့ပါသလား။
I did not used to trive a big car.,ကျွန်တော် ကား အကြီးတွေကို မောင်းတဲ့ အကျင့် မရှိခဲ့ပါဘူး။
I used not to have breakfast.,ကျွန်တော် မနက်စာ မစားတဲ့ အကျင့် ရှိခဲ့တယ်။
You will soon get used to living in the country.,ခင်ဗျား မကြာခင်မှာ ကျေးလက်တောရွာမှာ နေထိုင်ရတာနဲ့ အသားကျသွားပါလိမ့်မယ်။
Little by little he become used to his new office.,တဖြေးဖြေးချင်း သူ့ရုံးခန်း အသစ်နဲ့ ကျင့်သားရလာခဲ့ပါပြီ။
It took a long time to grow used to getting up early in the morning.,မနက် စောစော အိပ်ယာ ထတဲ့ အလေ့အကျင့် ရဖို့ အချိန် အကြာကြီး ယူပြီး ပြုစုပျိုးထောင်ခဲ့ရတယ်။
I'd rather go home than stay out too late.,ကျွန်တော် အပြင်မှာ နောက်ကျအောင် နေတာထက် အိမ်ကို ပြန်တာ ပိုလုပ်ချင်ပါတယ်။
I had rather stay late than come in early tomorrorw.,ကျွန်တော် မနက်ဖြန် မနက် အစောကြီး လာတာထက် နောက်ကျအောင် နေတာကို ပိုကြိုက်ပါတယ်။
I would rather exercise than sit on the couch all day.,ကျွန်တော် ထိုင်ခုံမှာ တစ်နေ့လုံး ထိုင်ရတာထက် လေ့ကျင့်ခန်း ပိုလုပ်ချင်ပါတယ်။
I had rather listen to my parents or get in trouble.,ကျွန်တော်က ပြဿနာ ရှာရတာထက် မိဘ စကားကို နားထောင်ရတာ ပိုကြိုက်ပါတယ်။
Would you like some tea or would you rather stick to Ma Ma?,မင်းက လက်ဖက်ရည် သောက်မှာလား၊ ဒါမှမဟုတ် မမ အနားမှာ ပိုပြီး ကပ်နေချင်တာလား။
I'd rather be with you.,ကို မင်းနဲ့ အတူ နေရတာကို ပိုကြိုက်ပါတယ်။
I'd rather talk about this later.,ကျွန်တော် ဒါနဲ့ ပတ်သတ်လို့ နောက်မှ ပိုပြောချင်ပါတယ်။
I would rather know the answer.,ကျွန်တော်က အဖြေကို ပိုပြီး သိပါလိမ့်မယ်။
I had rather handle the problem myself.,ကျွန်တော်က ပြဿနာကို ကိုယ်တိုင် ပိုပြီး ဖြေရှင်းချင်ပါတယ်။
Would you rather have tea?,ခင်ဗျား လက်ဘက်ရည်ကို အတော်လေး သောက်ပါသလား။
I feel like talking.,ကျွန်တော် စကား ပြောချင်ပါတယ်။
I feel like dancing.,ကျွန်တော် ကချင်တယ်။
I feel like going to the beach.,ကျွန်တော် ကမ်းခြေကို သွားချင်တယ်။
I feel like going for a walk.,ကျွန်တော် လမ်းလျှောက် ထွက်ချင်တယ်။
I feel like having a snack.,ကျွန်တော် မုန့် စားချင်တယ်။
I feel like watching TV.,ကျွန်တော် TV ကြည့်ချင်တယ်။
I feel like having friends on Facebook.,ကျွန်တော် Facebook မှာ သူငယ်ချင်းတွေ ရချင်တယ်။
I don't feel like leaving.,ကျွန်တော် ထွက်မသွားချင်ဘူး။
I do not feel like explaining.,ကျွန်တော် မရှင်းပြချင်ဘူး။
I don't feel comfortable talking about it.,အဲ့ဒါနဲ့ ပါတ်သက်ပြီး ပြောရတာ စိတ် သက်သက်သာသာ မဖြစ်ဘူး။
I do not feel like we are going in the right direction towards democracy.,ကျွန်တော် ဒီမိုကရေစီကို မှန်ကန်တဲ့ လမ်းကြောင်းမှာ သွားနေတယ်လို့ မခံစားရဘူး။
I feel like being an artist.,ကျွန်တော် အနုပညာရှင် တစ်ယောက် ဖြစ်ချင်တယ်။
I want to be a business man.,ကျွန်တော် စီးပွားရေးသမား တစ်ယောက် ဖြစ်ချင်တယ်။
I can't help thinking about you.,ကျွန်တော် ခင်ဗျား အကြောင်း မတွေးဘဲ မနေနိုင်ဘူး။
I cannot help working all the time.,ကျွန်တော် တချိန်လုံး အလုပ် မလုပ်ဘဲ မနေနိုင်ဘူး။
I can't help smiling when I see her.,ကျွန်တော် သူမကို မြင်တဲ့အချိန်မှာ မပြုံးဘဲ မနေနိုင်ဘူး။
I cannot help eating so much.,ကျွန်တော် အများကြီး မစားဘဲ မနေနိုင်ဘူး။
I can't help loving you.,ကျွန်တော် ခင်ဗျားကို မချစ်ဘဲ မနေနိုင်ဘူး။
I cannot help biting my nails when I am nervous.,ကျွန်တော် စိတ် ရှုပ်ရှားနေတဲ့အချိန်မှာ လက်သဲတွေကို မကိုင်ဘဲ မနေနိုင်ဘူး။
I can't help remembering the things you did.,ကျွန်တော် ခင်ဗျား လုပ်ခဲ့တဲ့ အရာကို သတိမရဘဲ မနေနိုင်ဘူး။
I cannot help smoking when I have been drinking.,ကျွန်တော် အရက် သောက်တဲ့အချိန်မှာ ဆေးလိပ် မသောက်ဘဲ မနေနိုင်ဘူး။